{
  "version": 1,
  "runId": "run_20260905_120003_69b0c691b1b06b2e082ab9e4",
  "specId": "reprobreak-3318",
  "environment": "local",
  "classification": "functional_regression",
  "startedAt": "2026-09-05T12:00:03.000Z",
  "completedAt": "2026-09-05T12:00:03.130Z",
  "explanation": "Recently Viewed still has 3 items; clear disabled=false",
  "steps": [
    {
      "index": 1,
      "intent": "Confirm clearing the Recently Viewed list",
      "status": "failed",
      "expectations": [
        {
          "expectation": "The Recently Viewed list is empty and its clear button is disabled",
          "status": "failed",
          "observation": "Recently Viewed still has 3 items; clear disabled=false"
        }
      ],
      "selectedTarget": {
        "summary": "confirmation button \"Ok\" in the open dialog",
        "role": "button",
        "name": "Ok"
      },
      "healing": {
        "strategy": "target_rediscovery",
        "outcome": "failed",
        "originalFailure": "The exact accessible name OK no longer identifies the confirmation button: page.getByRole('button', { name: 'OK', exact: true }). Previous target: page.getByRole('button', { name: 'OK', exact: true })",
        "replacement": "confirmation button \"Ok\" in the open dialog",
        "verification": "Recently Viewed still has 3 items; clear disabled=false",
        "beforeScreenshot": "screenshots/005-healing-before-step-1.png",
        "afterScreenshot": "screenshots/006-healing-after-step-1.png"
      }
    }
  ],
  "fixtures": [],
  "evidence": {
    "screenshots": [
      "screenshots/005-healing-before-step-1.png",
      "screenshots/006-healing-after-step-1.png",
      "screenshots/008-failure-step-1.png"
    ],
    "consoleErrors": [],
    "networkErrors": [],
    "unsupported": []
  },
  "events": [
    {
      "sequence": 1,
      "at": "2026-09-05T12:00:03.010Z",
      "type": "run_started",
      "message": "Running reprobreak-3318"
    },
    {
      "sequence": 2,
      "at": "2026-09-05T12:00:03.020Z",
      "type": "environment_ready",
      "status": "passed",
      "message": "web environment is ready"
    },
    {
      "sequence": 3,
      "at": "2026-09-05T12:00:03.030Z",
      "type": "step_started",
      "phase": "test",
      "stepIndex": 1,
      "message": "Confirm clearing the Recently Viewed list"
    },
    {
      "sequence": 4,
      "at": "2026-09-05T12:00:03.040Z",
      "type": "healing_started",
      "phase": "test",
      "stepIndex": 1,
      "message": "The exact accessible name OK no longer identifies the confirmation button: page.getByRole('button', { name: 'OK', exact: true }). Previous target: page.getByRole('button', { name: 'OK', exact: true })"
    },
    {
      "sequence": 5,
      "at": "2026-09-05T12:00:03.050Z",
      "type": "screenshot_captured",
      "message": "screenshots/005-healing-before-step-1.png",
      "phase": "test",
      "stepIndex": 1
    },
    {
      "sequence": 6,
      "at": "2026-09-05T12:00:03.060Z",
      "type": "screenshot_captured",
      "message": "screenshots/006-healing-after-step-1.png",
      "phase": "test",
      "stepIndex": 1
    },
    {
      "sequence": 7,
      "at": "2026-09-05T12:00:03.070Z",
      "type": "healing_completed",
      "phase": "test",
      "stepIndex": 1,
      "status": "failed",
      "message": "confirmation button \"Ok\" in the open dialog: Recently Viewed still has 3 items; clear disabled=false"
    },
    {
      "sequence": 8,
      "at": "2026-09-05T12:00:03.080Z",
      "type": "screenshot_captured",
      "message": "screenshots/008-failure-step-1.png",
      "phase": "test",
      "stepIndex": 1
    },
    {
      "sequence": 9,
      "at": "2026-09-05T12:00:03.090Z",
      "type": "step_completed",
      "phase": "test",
      "stepIndex": 1,
      "status": "failed",
      "message": "Expectation or action failed"
    },
    {
      "sequence": 10,
      "at": "2026-09-05T12:00:03.100Z",
      "type": "cleanup_started",
      "phase": "after",
      "message": "Running after fixtures"
    },
    {
      "sequence": 11,
      "at": "2026-09-05T12:00:03.110Z",
      "type": "cleanup_completed",
      "phase": "after",
      "status": "passed",
      "message": "Cleanup completed"
    },
    {
      "sequence": 12,
      "at": "2026-09-05T12:00:03.120Z",
      "type": "run_completed",
      "status": "failed",
      "message": "Recently Viewed still has 3 items; clear disabled=false"
    }
  ]
}
