{
  "version": 1,
  "runId": "run_20260905_120008_53629caa1ba3800206a52b4c",
  "specId": "reprobreak-3316",
  "environment": "local",
  "classification": "functional_regression",
  "startedAt": "2026-09-05T12:00:08.000Z",
  "completedAt": "2026-09-05T12:00:08.130Z",
  "explanation": "2 related Recently Viewed items remain",
  "steps": [
    {
      "index": 1,
      "intent": "Confirm deletion of the renamed folder from the tree",
      "status": "failed",
      "expectations": [
        {
          "expectation": "The renamed folder and its clock are absent from Recently Viewed",
          "status": "failed",
          "observation": "2 related Recently Viewed items remain"
        }
      ],
      "selectedTarget": {
        "summary": "confirmation button \"Ok\" in the open dialog",
        "role": "button",
        "name": "Ok"
      },
      "healing": {
        "strategy": "target_rediscovery",
        "outcome": "failed",
        "originalFailure": "The exact accessible name OK no longer identifies the confirmation button: page.getByRole('button', { name: 'OK', exact: true }). Previous target: page.getByRole('button', { name: 'OK', exact: true })",
        "replacement": "confirmation button \"Ok\" in the open dialog",
        "verification": "2 related Recently Viewed items remain",
        "beforeScreenshot": "screenshots/005-healing-before-step-1.png",
        "afterScreenshot": "screenshots/006-healing-after-step-1.png"
      }
    }
  ],
  "fixtures": [],
  "evidence": {
    "screenshots": [
      "screenshots/005-healing-before-step-1.png",
      "screenshots/006-healing-after-step-1.png",
      "screenshots/008-failure-step-1.png"
    ],
    "consoleErrors": [],
    "networkErrors": [],
    "unsupported": []
  },
  "events": [
    {
      "sequence": 1,
      "at": "2026-09-05T12:00:08.010Z",
      "type": "run_started",
      "message": "Running reprobreak-3316"
    },
    {
      "sequence": 2,
      "at": "2026-09-05T12:00:08.020Z",
      "type": "environment_ready",
      "status": "passed",
      "message": "web environment is ready"
    },
    {
      "sequence": 3,
      "at": "2026-09-05T12:00:08.030Z",
      "type": "step_started",
      "phase": "test",
      "stepIndex": 1,
      "message": "Confirm deletion of the renamed folder from the tree"
    },
    {
      "sequence": 4,
      "at": "2026-09-05T12:00:08.040Z",
      "type": "healing_started",
      "phase": "test",
      "stepIndex": 1,
      "message": "The exact accessible name OK no longer identifies the confirmation button: page.getByRole('button', { name: 'OK', exact: true }). Previous target: page.getByRole('button', { name: 'OK', exact: true })"
    },
    {
      "sequence": 5,
      "at": "2026-09-05T12:00:08.050Z",
      "type": "screenshot_captured",
      "message": "screenshots/005-healing-before-step-1.png",
      "phase": "test",
      "stepIndex": 1
    },
    {
      "sequence": 6,
      "at": "2026-09-05T12:00:08.060Z",
      "type": "screenshot_captured",
      "message": "screenshots/006-healing-after-step-1.png",
      "phase": "test",
      "stepIndex": 1
    },
    {
      "sequence": 7,
      "at": "2026-09-05T12:00:08.070Z",
      "type": "healing_completed",
      "phase": "test",
      "stepIndex": 1,
      "status": "failed",
      "message": "confirmation button \"Ok\" in the open dialog: 2 related Recently Viewed items remain"
    },
    {
      "sequence": 8,
      "at": "2026-09-05T12:00:08.080Z",
      "type": "screenshot_captured",
      "message": "screenshots/008-failure-step-1.png",
      "phase": "test",
      "stepIndex": 1
    },
    {
      "sequence": 9,
      "at": "2026-09-05T12:00:08.090Z",
      "type": "step_completed",
      "phase": "test",
      "stepIndex": 1,
      "status": "failed",
      "message": "Expectation or action failed"
    },
    {
      "sequence": 10,
      "at": "2026-09-05T12:00:08.100Z",
      "type": "cleanup_started",
      "phase": "after",
      "message": "Running after fixtures"
    },
    {
      "sequence": 11,
      "at": "2026-09-05T12:00:08.110Z",
      "type": "cleanup_completed",
      "phase": "after",
      "status": "passed",
      "message": "Cleanup completed"
    },
    {
      "sequence": 12,
      "at": "2026-09-05T12:00:08.120Z",
      "type": "run_completed",
      "status": "failed",
      "message": "2 related Recently Viewed items remain"
    }
  ]
}
