{
  "version": 1,
  "runId": "run_20260905_120010_fc5fbff0d53681fb56138432",
  "specId": "reprobreak-5609",
  "environment": "local",
  "classification": "healed",
  "startedAt": "2026-09-05T12:00:10.000Z",
  "completedAt": "2026-09-05T12:00:10.130Z",
  "explanation": "Recovered 1 interaction and verified every original expectation unchanged",
  "steps": [
    {
      "index": 1,
      "intent": "Expand the suite in the test tree and open its annotation test",
      "status": "passed",
      "expectations": [
        {
          "expectation": "The annotation test can be opened from the expanded suite",
          "status": "passed",
          "observation": "The expanded suite exposes annotation test"
        }
      ],
      "selectedTarget": {
        "summary": "treeitem \"suite\" via \"Expand suite\" in the live test tree",
        "role": "treeitem",
        "name": "suite"
      },
      "healing": {
        "strategy": "target_rediscovery",
        "outcome": "healed",
        "originalFailure": "The UI tree no longer exposes the suite as a listitem: page.getByRole('listitem'). Previous target: page.getByRole('listitem')",
        "replacement": "treeitem \"suite\" via \"Expand suite\" in the live test tree",
        "verification": "The original expectations passed unchanged after recovery",
        "beforeScreenshot": "screenshots/005-healing-before-step-1.png",
        "afterScreenshot": "screenshots/006-healing-after-step-1.png"
      }
    }
  ],
  "fixtures": [],
  "evidence": {
    "screenshots": [
      "screenshots/005-healing-before-step-1.png",
      "screenshots/006-healing-after-step-1.png",
      "screenshots/008-checkpoint-step-1.png"
    ],
    "consoleErrors": [],
    "networkErrors": [],
    "unsupported": []
  },
  "events": [
    {
      "sequence": 1,
      "at": "2026-09-05T12:00:10.010Z",
      "type": "run_started",
      "message": "Running reprobreak-5609"
    },
    {
      "sequence": 2,
      "at": "2026-09-05T12:00:10.020Z",
      "type": "environment_ready",
      "status": "passed",
      "message": "web environment is ready"
    },
    {
      "sequence": 3,
      "at": "2026-09-05T12:00:10.030Z",
      "type": "step_started",
      "phase": "test",
      "stepIndex": 1,
      "message": "Expand the suite in the test tree and open its annotation test"
    },
    {
      "sequence": 4,
      "at": "2026-09-05T12:00:10.040Z",
      "type": "healing_started",
      "phase": "test",
      "stepIndex": 1,
      "message": "The UI tree no longer exposes the suite as a listitem: page.getByRole('listitem'). Previous target: page.getByRole('listitem')"
    },
    {
      "sequence": 5,
      "at": "2026-09-05T12:00:10.050Z",
      "type": "screenshot_captured",
      "message": "screenshots/005-healing-before-step-1.png",
      "phase": "test",
      "stepIndex": 1
    },
    {
      "sequence": 6,
      "at": "2026-09-05T12:00:10.060Z",
      "type": "screenshot_captured",
      "message": "screenshots/006-healing-after-step-1.png",
      "phase": "test",
      "stepIndex": 1
    },
    {
      "sequence": 7,
      "at": "2026-09-05T12:00:10.070Z",
      "type": "healing_completed",
      "phase": "test",
      "stepIndex": 1,
      "status": "passed",
      "message": "treeitem \"suite\" via \"Expand suite\" in the live test tree: The original expectations passed unchanged after recovery"
    },
    {
      "sequence": 8,
      "at": "2026-09-05T12:00:10.080Z",
      "type": "screenshot_captured",
      "message": "screenshots/008-checkpoint-step-1.png",
      "phase": "test",
      "stepIndex": 1
    },
    {
      "sequence": 9,
      "at": "2026-09-05T12:00:10.090Z",
      "type": "step_completed",
      "phase": "test",
      "stepIndex": 1,
      "status": "passed",
      "message": "Expectations passed"
    },
    {
      "sequence": 10,
      "at": "2026-09-05T12:00:10.100Z",
      "type": "cleanup_started",
      "phase": "after",
      "message": "Running after fixtures"
    },
    {
      "sequence": 11,
      "at": "2026-09-05T12:00:10.110Z",
      "type": "cleanup_completed",
      "phase": "after",
      "status": "passed",
      "message": "Cleanup completed"
    },
    {
      "sequence": 12,
      "at": "2026-09-05T12:00:10.120Z",
      "type": "run_completed",
      "status": "passed",
      "message": "Recovered 1 interaction and verified every original expectation unchanged"
    }
  ]
}
