{
  "version": 1,
  "runId": "run_20260905_120000_f37e8ca51ffcf469cf65aef4",
  "specId": "reprobreak-5609",
  "environment": "local",
  "classification": "functional_regression",
  "startedAt": "2026-09-05T12:00:00.000Z",
  "completedAt": "2026-09-05T12:00:00.130Z",
  "explanation": "The suite did not expose annotation test",
  "steps": [
    {
      "index": 1,
      "intent": "Expand the suite in the test tree and open its annotation test",
      "status": "failed",
      "expectations": [
        {
          "expectation": "The annotation test can be opened from the expanded suite",
          "status": "failed",
          "observation": "The suite did not expose annotation test"
        }
      ],
      "selectedTarget": {
        "summary": "treeitem \"suite\" via \"Expand suite\" in the live test tree",
        "role": "treeitem",
        "name": "suite"
      },
      "healing": {
        "strategy": "target_rediscovery",
        "outcome": "failed",
        "originalFailure": "The UI tree no longer exposes the suite as a listitem: page.getByRole('listitem'). Previous target: page.getByRole('listitem')",
        "replacement": "treeitem \"suite\" via \"Expand suite\" in the live test tree",
        "verification": "The suite did not expose annotation test",
        "beforeScreenshot": "screenshots/005-healing-before-step-1.png",
        "afterScreenshot": "screenshots/006-healing-after-step-1.png"
      }
    }
  ],
  "fixtures": [],
  "evidence": {
    "screenshots": [
      "screenshots/005-healing-before-step-1.png",
      "screenshots/006-healing-after-step-1.png",
      "screenshots/008-failure-step-1.png"
    ],
    "consoleErrors": [
      "Failed to load resource: the server responded with a status of 404 (Not Found)"
    ],
    "networkErrors": [],
    "unsupported": []
  },
  "events": [
    {
      "sequence": 1,
      "at": "2026-09-05T12:00:00.010Z",
      "type": "run_started",
      "message": "Running reprobreak-5609"
    },
    {
      "sequence": 2,
      "at": "2026-09-05T12:00:00.020Z",
      "type": "environment_ready",
      "status": "passed",
      "message": "web environment is ready"
    },
    {
      "sequence": 3,
      "at": "2026-09-05T12:00:00.030Z",
      "type": "step_started",
      "phase": "test",
      "stepIndex": 1,
      "message": "Expand the suite in the test tree and open its annotation test"
    },
    {
      "sequence": 4,
      "at": "2026-09-05T12:00:00.040Z",
      "type": "healing_started",
      "phase": "test",
      "stepIndex": 1,
      "message": "The UI tree no longer exposes the suite as a listitem: page.getByRole('listitem'). Previous target: page.getByRole('listitem')"
    },
    {
      "sequence": 5,
      "at": "2026-09-05T12:00:00.050Z",
      "type": "screenshot_captured",
      "message": "screenshots/005-healing-before-step-1.png",
      "phase": "test",
      "stepIndex": 1
    },
    {
      "sequence": 6,
      "at": "2026-09-05T12:00:00.060Z",
      "type": "screenshot_captured",
      "message": "screenshots/006-healing-after-step-1.png",
      "phase": "test",
      "stepIndex": 1
    },
    {
      "sequence": 7,
      "at": "2026-09-05T12:00:00.070Z",
      "type": "healing_completed",
      "phase": "test",
      "stepIndex": 1,
      "status": "failed",
      "message": "treeitem \"suite\" via \"Expand suite\" in the live test tree: The suite did not expose annotation test"
    },
    {
      "sequence": 8,
      "at": "2026-09-05T12:00:00.080Z",
      "type": "screenshot_captured",
      "message": "screenshots/008-failure-step-1.png",
      "phase": "test",
      "stepIndex": 1
    },
    {
      "sequence": 9,
      "at": "2026-09-05T12:00:00.090Z",
      "type": "step_completed",
      "phase": "test",
      "stepIndex": 1,
      "status": "failed",
      "message": "Expectation or action failed"
    },
    {
      "sequence": 10,
      "at": "2026-09-05T12:00:00.100Z",
      "type": "cleanup_started",
      "phase": "after",
      "message": "Running after fixtures"
    },
    {
      "sequence": 11,
      "at": "2026-09-05T12:00:00.110Z",
      "type": "cleanup_completed",
      "phase": "after",
      "status": "passed",
      "message": "Cleanup completed"
    },
    {
      "sequence": 12,
      "at": "2026-09-05T12:00:00.120Z",
      "type": "run_completed",
      "status": "failed",
      "message": "The suite did not expose annotation test"
    }
  ]
}
